[
  {
    "spec": "noa.receipt/0.1",
    "id": "rcpt_0000000000000000000000000A",
    "ts": "2026-06-20T07:30:54.000Z",
    "scope": {
      "tenant": "store_demo",
      "chain": "store_demo_chain"
    },
    "agent": {
      "id": "agent-refunds",
      "model": "example-provider/llm-v1",
      "principal": "SERVICE"
    },
    "action": {
      "id": "payment.refund",
      "canonical": "payment.refund",
      "riskClass": "HIGH",
      "paramsHash": "sha256:9c10250f78b359d3c3abdf2dcd91a50af8aa4f7529cfbf3cfead14cf2500eac6",
      "reversible": false,
      "rollbackRef": null
    },
    "governance": {
      "mode": "on",
      "verdict": "DEFERRED",
      "ruleId": "high-risk-deferral",
      "approval": null,
      "sandboxed": false
    },
    "chain": {
      "seq": 0,
      "prevHash": null,
      "hash": "sha256:98bb2287599b187e7227aca68aa84933ff34272c2ac597932a9563f9266f6c59"
    },
    "sig": {
      "alg": "ed25519",
      "kid": "kid-attacker",
      "value": "CvtJM3J0C7chqiwD+vXIH6XJc/WDyVh/CHvyVyadgtIoh3RUmOMrva+NKYRbp6ojaHiPXGWHFonshEvgTt1zDw=="
    }
  },
  {
    "spec": "noa.receipt/0.1",
    "id": "rcpt_0000000000000000000000000B",
    "ts": "2026-06-20T07:31:10.000Z",
    "scope": {
      "tenant": "store_demo",
      "chain": "store_demo_chain"
    },
    "agent": {
      "id": "agent-refunds",
      "model": "example-provider/llm-v1",
      "principal": "HUMAN"
    },
    "action": {
      "id": "payment.refund",
      "canonical": "payment.refund",
      "riskClass": "HIGH",
      "paramsHash": "sha256:9c10250f78b359d3c3abdf2dcd91a50af8aa4f7529cfbf3cfead14cf2500eac6",
      "reversible": false,
      "rollbackRef": null
    },
    "governance": {
      "mode": "on",
      "verdict": "EXECUTED",
      "ruleId": "human-approved",
      "approval": {
        "by": "HUMAN:hmac-sha256:ef5b31ebb954ff5a109e51c22c06ddb662d7725ceda4eb42739dd375528519b3",
        "at": "2026-06-20T07:31:08.000Z"
      },
      "sandboxed": false
    },
    "chain": {
      "seq": 1,
      "prevHash": "sha256:98bb2287599b187e7227aca68aa84933ff34272c2ac597932a9563f9266f6c59",
      "hash": "sha256:63374391d8ccab5d45b75172914a480811cff68621628a52ee60e91278592b93"
    },
    "sig": {
      "alg": "ed25519",
      "kid": "kid-attacker",
      "value": "tG9Vb6zNQeo+LBmU3h0AMfjOxWs9H5Y2XoOtzahEEtjlUDhBmXaCF9hRUGo7Y9kX3BqGBuET2u1DCch2YWD4Cw=="
    }
  },
  {
    "spec": "noa.receipt/0.1",
    "id": "rcpt_0000000000000000000000000C",
    "ts": "2026-06-20T07:45:00.000Z",
    "scope": {
      "tenant": "store_demo",
      "chain": "store_demo_chain"
    },
    "agent": {
      "id": "agent-refunds",
      "model": "example-provider/llm-v1",
      "principal": "POLICY"
    },
    "action": {
      "id": "email.send",
      "canonical": "email.send",
      "riskClass": "LOW",
      "paramsHash": "sha256:1039f4444937bfcc44d6a6635039cd09db195ebe0b618146280cb8ff107d4329",
      "reversible": true,
      "rollbackRef": null
    },
    "governance": {
      "mode": "on",
      "verdict": "EXECUTED",
      "ruleId": "low-risk-auto",
      "approval": null,
      "sandboxed": false
    },
    "chain": {
      "seq": 2,
      "prevHash": "sha256:63374391d8ccab5d45b75172914a480811cff68621628a52ee60e91278592b93",
      "hash": "sha256:dad14bf2d0a49a223bf1a9b113ada8aa0fcedb1f470ec09e1589734a96f3bdf6"
    },
    "sig": {
      "alg": "ed25519",
      "kid": "kid-attacker",
      "value": "pJEaAZA9zAikGUgI4DHMiuQbrg+i66E4Sz8iwrPbDQzUGrb8wOfXAZfZvluWX0p3h88D2Z5vqFYEbHjzDK2BBw=="
    }
  }
]
