[
  {
    "spec": "noa.receipt/0.1",
    "id": "rcpt_golden_identity_a0",
    "ts": "2026-05-03T11:00:00.000Z",
    "scope": {
      "tenant": "golden_tenant",
      "chain": "golden_identity_chain"
    },
    "agent": {
      "id": "golden-agent-a",
      "model": "example-provider/llm-v1",
      "principal": "SERVICE"
    },
    "action": {
      "id": "payment.refund",
      "canonical": "payment.refund",
      "riskClass": "CRITICAL",
      "paramsHash": "sha256:c22f2c182ae5abc82cea24a39f638820f6906714011f93805f00a9fc45225122",
      "reversible": false,
      "rollbackRef": null
    },
    "governance": {
      "mode": "on",
      "verdict": "EXECUTED",
      "ruleId": "golden-identity-rule",
      "approval": null,
      "sandboxed": false
    },
    "chain": {
      "seq": 0,
      "prevHash": null,
      "hash": "sha256:7067dc705c1030dc5e4c6e5ae32936ebb64dcf137c105985d1dd82274000567f"
    },
    "sig": {
      "alg": "ed25519",
      "kid": "golden-signer-a",
      "value": "9XRasQrlijKQSAV6Qf8dB3RUW22rweKPOEda6Csy6R7B85bwSPTqyxnCUKVRJMB6OZh0PW9zs+H5OW19BchjBQ=="
    }
  },
  {
    "spec": "noa.receipt/0.1",
    "id": "rcpt_golden_identity_b1",
    "ts": "2026-05-03T11:00:30.000Z",
    "scope": {
      "tenant": "golden_tenant",
      "chain": "golden_identity_chain"
    },
    "agent": {
      "id": "golden-agent-b",
      "model": "example-provider/llm-v1",
      "principal": "SERVICE"
    },
    "action": {
      "id": "payment.refund",
      "canonical": "payment.refund",
      "riskClass": "CRITICAL",
      "paramsHash": "sha256:4a24ba80e0e7a30ac89d15d7c1fdbe65d6f9acb6bcefa5ea20dcdaabc4ba621e",
      "reversible": false,
      "rollbackRef": null
    },
    "governance": {
      "mode": "on",
      "verdict": "EXECUTED",
      "ruleId": "golden-identity-rule",
      "approval": null,
      "sandboxed": false
    },
    "chain": {
      "seq": 1,
      "prevHash": "sha256:7067dc705c1030dc5e4c6e5ae32936ebb64dcf137c105985d1dd82274000567f",
      "hash": "sha256:3396effcc0ef3fff4d9a79252a02e61be3dc2adf27793d93a0364573c75199f5"
    },
    "sig": {
      "alg": "ed25519",
      "kid": "golden-signer-b",
      "value": "4gA9EmzUOyS0/9QtVKKpUrLuSu0rzao+pnU0y3oh2RZpQavYnMgxILYckbJKulmTKS1/aQbaBIuXMs6ne79cDQ=="
    }
  }
]
