[
  {
    "spec": "noa.receipt/0.1",
    "id": "rcpt_0000000000000000000000000B",
    "ts": "2026-06-20T07:31:10.000Z",
    "scope": {
      "tenant": "store_demo",
      "chain": "store_demo_chain"
    },
    "agent": {
      "id": "agent-refunds",
      "model": "example-provider/llm-v1",
      "principal": "HUMAN"
    },
    "action": {
      "id": "payment.refund",
      "canonical": "payment.refund",
      "riskClass": "HIGH",
      "paramsHash": "sha256:9c10250f78b359d3c3abdf2dcd91a50af8aa4f7529cfbf3cfead14cf2500eac6",
      "reversible": false,
      "rollbackRef": null
    },
    "governance": {
      "mode": "on",
      "verdict": "EXECUTED",
      "ruleId": "human-approved",
      "approval": {
        "by": "HUMAN:hmac-sha256:ef5b31ebb954ff5a109e51c22c06ddb662d7725ceda4eb42739dd375528519b3",
        "at": "2026-06-20T07:31:08.000Z"
      },
      "sandboxed": false
    },
    "chain": {
      "seq": 1,
      "prevHash": "sha256:588d3e9e6bb450408323ae0648c410a0b5725294c4a4e789add87a719e3a9248",
      "hash": "sha256:7ad3110ab586f9bf840d8134f1be2fbe45595f3a3125a1ebfa9d9cd41c5beddb"
    },
    "sig": {
      "alg": "ed25519",
      "kid": "noa-test-key-2026",
      "value": "Hz20gANBj+fySv0Q6+UWI/rrvwZemTp1gLZwVFqEMGNtnAdKLChm//WcztcqfHITMiKF1zRaWGjJUxSfrOoSAw=="
    }
  },
  {
    "spec": "noa.receipt/0.1",
    "id": "rcpt_0000000000000000000000000C",
    "ts": "2026-06-20T07:45:00.000Z",
    "scope": {
      "tenant": "store_demo",
      "chain": "store_demo_chain"
    },
    "agent": {
      "id": "agent-refunds",
      "model": "example-provider/llm-v1",
      "principal": "POLICY"
    },
    "action": {
      "id": "email.send",
      "canonical": "email.send",
      "riskClass": "LOW",
      "paramsHash": "sha256:1039f4444937bfcc44d6a6635039cd09db195ebe0b618146280cb8ff107d4329",
      "reversible": true,
      "rollbackRef": null
    },
    "governance": {
      "mode": "on",
      "verdict": "EXECUTED",
      "ruleId": "low-risk-auto",
      "approval": null,
      "sandboxed": false
    },
    "chain": {
      "seq": 2,
      "prevHash": "sha256:7ad3110ab586f9bf840d8134f1be2fbe45595f3a3125a1ebfa9d9cd41c5beddb",
      "hash": "sha256:05285a7c616b5b5f686039bddc025a6bf2d2f76b401b56b6730a69ea043d31e5"
    },
    "sig": {
      "alg": "ed25519",
      "kid": "noa-test-key-2026",
      "value": "WPIOEHDERLjPDhB/DLmY1z/cqh/WjBtNDAzjKy+2mjOzPd13XMhxiohwhuMyGzRfQbvqDvjReQvdPt0mr9q7Cw=="
    }
  }
]
