[
  {
    "spec": "noa.receipt/0.1",
    "id": "rcpt_golden_identity_impersonation",
    "ts": "2026-05-03T12:00:00.000Z",
    "scope": {
      "tenant": "golden_tenant",
      "chain": "golden_identity_chain"
    },
    "agent": {
      "id": "golden-agent-a",
      "model": "example-provider/llm-v1",
      "principal": "SERVICE"
    },
    "action": {
      "id": "payment.refund",
      "canonical": "payment.refund",
      "riskClass": "CRITICAL",
      "paramsHash": "sha256:c22f2c182ae5abc82cea24a39f638820f6906714011f93805f00a9fc45225122",
      "reversible": false,
      "rollbackRef": null
    },
    "governance": {
      "mode": "on",
      "verdict": "EXECUTED",
      "ruleId": "golden-identity-rule",
      "approval": null,
      "sandboxed": false
    },
    "chain": {
      "seq": 0,
      "prevHash": null,
      "hash": "sha256:bea98da5180a1073544756efdee43d96ba751db3a8c107529372dec4f3e13445"
    },
    "sig": {
      "alg": "ed25519",
      "kid": "golden-signer-b",
      "value": "8gQ2KBcfvw0Pqf/m4dQnsEDLRtFYRduMGdn0jqFknI60OdRcLn8mWkoqSAwuk/uu8ibW/yNQst/OBIFocCtnCg=="
    }
  }
]
