[
  {
    "spec": "noa.receipt/0.1",
    "id": "rcpt_golden_multi_0000000001",
    "ts": "2026-05-02T10:00:00.000Z",
    "scope": {
      "tenant": "golden_tenant",
      "chain": "golden_multi_chain"
    },
    "agent": {
      "id": "golden-agent-refunds",
      "model": "example-provider/llm-v1",
      "principal": "SERVICE"
    },
    "action": {
      "id": "payment.refund",
      "canonical": "payment.refund",
      "riskClass": "HIGH",
      "paramsHash": "sha256:9c10250f78b359d3c3abdf2dcd91a50af8aa4f7529cfbf3cfead14cf2500eac6",
      "reversible": false,
      "rollbackRef": null
    },
    "governance": {
      "mode": "on",
      "verdict": "DEFERRED",
      "ruleId": "high-risk-deferral",
      "approval": null,
      "sandboxed": false
    },
    "chain": {
      "seq": 0,
      "prevHash": null,
      "hash": "sha256:f44f374daeef8cc21ff58f853bd6b51fad6190072826e398948d2d9f02bacd08"
    },
    "sig": {
      "alg": "ed25519",
      "kid": "golden-signer-1",
      "value": "kxjDiIcDPM+SWd5TsD5RNuPvuTmiXnAP6x+YwQPLf/Vs3iQanCWkBJwM6N2/ejr3zeEV/XBAJ5NRaqiVsrekAQ=="
    }
  },
  {
    "spec": "noa.receipt/0.1",
    "id": "rcpt_golden_multi_0000000002",
    "ts": "2026-05-02T10:00:20.000Z",
    "scope": {
      "tenant": "golden_tenant",
      "chain": "golden_multi_chain"
    },
    "agent": {
      "id": "golden-agent-refunds",
      "model": "example-provider/llm-v1",
      "principal": "HUMAN"
    },
    "action": {
      "id": "payment.refund",
      "canonical": "payment.refund",
      "riskClass": "HIGH",
      "paramsHash": "sha256:9c10250f78b359d3c3abdf2dcd91a50af8aa4f7529cfbf3cfead14cf2500eac6",
      "reversible": false,
      "rollbackRef": null
    },
    "governance": {
      "mode": "on",
      "verdict": "EXECUTED",
      "ruleId": "human-approved",
      "approval": {
        "by": "HUMAN:owner@golden.example",
        "at": "2026-05-02T10:00:18.000Z"
      },
      "sandboxed": false
    },
    "chain": {
      "seq": 1,
      "prevHash": "sha256:f44f374daeef8cc21ff58f853bd6b51fad6190072826e398948d2d9f02bacd08",
      "hash": "sha256:c8b687510b67f95a3d4bfbf7ab1be27600be807d8a0e8e5bd6bfad69b1662f9c"
    },
    "sig": {
      "alg": "ed25519",
      "kid": "golden-signer-1",
      "value": "v/O6pQAiGOJrL9/DPbRULvpEJPIryVmBYUfbYV0SMZK01/RpFjhbVSxIZc3cujEh+WercRPQ3tDkFCH+BglJBw=="
    }
  },
  {
    "spec": "noa.receipt/0.1",
    "id": "rcpt_golden_multi_0000000003",
    "ts": "2026-05-02T10:05:00.000Z",
    "scope": {
      "tenant": "golden_tenant",
      "chain": "golden_multi_chain"
    },
    "agent": {
      "id": "golden-agent-notify",
      "model": "example-provider/llm-v1",
      "principal": "POLICY"
    },
    "action": {
      "id": "email.send",
      "canonical": "email.send",
      "riskClass": "LOW",
      "paramsHash": "sha256:1039f4444937bfcc44d6a6635039cd09db195ebe0b618146280cb8ff107d4329",
      "reversible": true,
      "rollbackRef": null
    },
    "governance": {
      "mode": "on",
      "verdict": "EXECUTED",
      "ruleId": "low-risk-auto",
      "approval": null,
      "sandboxed": false
    },
    "chain": {
      "seq": 2,
      "prevHash": "sha256:c8b687510b67f95a3d4bfbf7ab1be27600be807d8a0e8e5bd6bfad69b1662f9c",
      "hash": "sha256:04d09cf94f550edb677b769937a71fb5ddea1c678348379227c8b79aca805982"
    },
    "sig": {
      "alg": "ed25519",
      "kid": "golden-signer-2",
      "value": "hCWdmKg6/+xzWMfZPqkumSB8ZwOHamQPIop4Sk2GG6tFzA7EgMoDNPmJZtUmyp14YQ94XuOZMBk3vcR0+j0GAQ=="
    }
  },
  {
    "spec": "noa.receipt/0.1",
    "id": "rcpt_golden_multi_0000000004",
    "ts": "2026-05-02T10:10:00.000Z",
    "scope": {
      "tenant": "golden_tenant",
      "chain": "golden_multi_chain"
    },
    "agent": {
      "id": "golden-agent-refunds",
      "model": "example-provider/llm-v1",
      "principal": "SERVICE"
    },
    "action": {
      "id": "account.delete",
      "canonical": "account.delete",
      "riskClass": "CRITICAL",
      "paramsHash": "sha256:4bbc1c7dff0600a6e0960bcb00fc68c0e8e04ad95b736d31e9b7572026c3130f",
      "reversible": false,
      "rollbackRef": null
    },
    "governance": {
      "mode": "on",
      "verdict": "BLOCKED",
      "ruleId": "critical-block",
      "approval": null,
      "sandboxed": true
    },
    "chain": {
      "seq": 3,
      "prevHash": "sha256:04d09cf94f550edb677b769937a71fb5ddea1c678348379227c8b79aca805982",
      "hash": "sha256:0ea4f941c64d4307776d7fc529472dcaa9247f4bb0af5684809e9f305d64a821"
    },
    "sig": {
      "alg": "ed25519",
      "kid": "golden-signer-1",
      "value": "jRnrXd1zbfe8qcGGJv4Y1o+KRxxcc/ZemuX9KrGTmpaLU5ukuCx0Ft9qFpEaz+/4xI8hxb+sOOB4eu9jHVnfAg=="
    }
  }
]
